{
  "project_name": "claude_code",
  "project_slug": "claude-code",
  "central_brain_path": "~/DES/second-brain",
  "project_brain_path": ".project-brain",
  "brain_mode": "standard",
  "brain_kernel_enabled": true,
  "gbrain_enabled": false,
  "gbrain_evals_enabled": false,
  "graphify_enabled": false,
  "reference_repositories_enabled": true,
  "canon_requires_approval": true,
  "sensitive_paths": [
    ".env",
    ".env.*",
    "secrets/",
    "credentials/",
    "private/",
    "legal-sensitive/",
    "client-sensitive/",
    "patient/",
    "financial/"
  ],
  "created_at": "2026-07-09",
  "last_brain_lint": "",
  "last_memory_compile": ""
}
